id,sentence,dataSplit,casename,matched,ruleType
6807,이 사건 범행을 이른바 누범기간 중에 저지른 범행이기도 하다.,train,사기,누범,공통_동종범죄
6810,피고인은 사기죄로 징역형의 집행유예를 선고받는 등 동종의 범죄전력이 여러 차례 있음에도 불구하고 자숙하지 아니한 채 다시 이 사건 사기 범행을 저질렀다.,train,사기,집행유예,공통_동종범죄
6811,범행전후의 정황(동종전력은 없고,train,사기,동종,공통_동종범죄
6812,- 유리한 정상 : 동종 전과나 징역형의 집행유예 이상의 전과 없음,train,사기,동종,공통_동종범죄
6813,피고인에게 동종 범죄 내지 벌금형을 초과하여 처벌받은 전력이 없다.,train,사기,동종,공통_동종범죄
6814,피고인이 동종 범행으로 1회 집행유예를 받은 전력이 있는 점,train,사기,동종,공통_동종범죄
6816,피고인은 2017. 3. 29. 서울서부지방법원에서 횡령죄로 징역 8월에 집행유예 2년을 선고받아 2017. 7. 7. 그 판결이 확정되어 집행유예기간 중에 있음에도 판시 사기범행을 하였던 점,train,사기,집행유예,공통_동종범죄
6817,동종의 범행으로 처벌받은 전력이 다수 있는 점을 불리한 정상으로,train,사기,동종,공통_동종범죄
6818,피고인은 2017년에 사기죄로 벌금형의 처벌을 받았고,train,사기,벌금형,공통_동종범죄
6818,피고인의 전과관계 등에 비추어 보면 그 죄질이 좋지 않다.,train,사기,전과,공통_동종범죄
6820,피고인이 2016. 6.경 사기죄로 징역 6월에 집행유예 2년을 선고받고 집행유예기간 중에 이 사건 범행을 저지른 점 및 그 밖에 피고인의 나이,train,사기,집행유예,공통_동종범죄
6821,피고인은 2011. 6.경 사기죄로 벌금 200만 원의 형사처벌을 받은 전력이 있다.,train,사기,형사처벌,공통_동종범죄
6823,수차례의 동종 범행 전력,train,사기,동종,공통_동종범죄
6825,피고인에게 동종 전력이나 벌금형을 넘는 범죄전력이 없다.,train,사기,동종,공통_동종범죄
6826,피고인이 1988. 건축법위반으로 벌금 40만 원의 처벌을 받은 이외에 형사처벌을 받은 전력이 없는 점을 유리한 정상으로 참작하고,train,사기,형사처벌,공통_동종범죄
6828,판결이 확정된 판시 전과와 형법 제37조 후단 경합의 관계에 있으므로 양형기준이 적용되지 않는다.,train,사기,전과,공통_동종범죄
6828,피고인이 동종 범행으로 징역형의 집행유예를 포함하여 여러 차례 처벌받은 전력이 있음에도 또다시 이 사건 범행을 저질렀는바,train,사기,동종,공통_동종범죄
6828,이 사건 범행은 판시 전과와 형법 제37조 후단 경합범 관계에 있어 동시에 판결할 경우의 형평을 고려해야 하는 점,train,사기,전과,공통_동종범죄
6828,피고인이 이 사건 범행을 인정하고 반성하면서 피해 회복을 위해 노력하고 있다고 보이는 점 등을 피고인에게 유리한 정상으로 참작하여 집행유예의 판결을 선고한다.,train,사기,집행유예,공통_동종범죄
6829,특별가중인자·상습범인 경우·동종 누범,train,사기,동종,공통_동종범죄
6829,동종 전과 다수임에도 무전취식의 습벽을 버리지 못하고 있어 실형이 불가피하다.,train,사기,동종,공통_동종범죄
6831,피고인은 사건 당시 사기죄로 인한 집행유예기간 중(피고인은 2019. 11. 6. 수원지방법원 성남지원에서 사기죄로 징역 4월에 집행유예 2년을 선고받고,train,사기,집행유예,공통_동종범죄
6832,피고인에게 동종 범죄로 처벌받은 전력이 실형을 포함하여 수회 있음에도 재차 이 사건 범행을 저질렀다.,train,사기,동종,공통_동종범죄
6834,피고인이 초범인,train,사기,초범,공통_동종범죄
6836,한편 피고인이 대체로 잘못을 인정하고 반성하는 태도를 보이며 동종 범죄로 처벌받은 전력이 없는 점,train,사기,동종,공통_동종범죄
6837,피고인에게 벌금형보다 무거운 전과나 동종전과가 없는 점 등,train,사기,벌금형,공통_동종범죄
6838,1년 8월 ~ 6년(동종경합 합산 결과 유형 1단계 상승: 형량 하한 1/3을 감경),train,사기,동종,공통_동종범죄
6839,피고인은 동종범행으로 수회 처벌받은 전력이 있고 누범기간 중에 다시 이 사건 범행들을 저지른 점,train,사기,동종,공통_동종범죄
6840,피고인에게 동종 범죄전력이 있는 점 등의 불리한 정상이 있으나,train,사기,동종,공통_동종범죄
6840,벌금형보다 무겁게 처벌받은 전력이 없는 점,train,사기,벌금형,공통_동종범죄
6841,피고인에게 동종 전력이 있는 점(벌금형 2회)을 고려하면 피고인에 대한 징역형의 실형 선고가 불가피하다.,train,사기,동종,공통_동종범죄
6842,징역 8월~4년(동종경합 합산 결과 1단계 상승으로 형량범위 하한의 1/3 감ㄱ),train,사기,동종,공통_동종범죄
6845,피고인이 범행을 자백하고 있고 피고인에게 별 전과가 없긴 하나,train,사기,전과,공통_동종범죄
6847,피고인이 동종 범행으로 수차례 실형을 선고받은 전력이 있고,train,사기,동종,공통_동종범죄
6848,○ 유리한 정상: 동종 범죄 전력 없고 집행유예 이상 범죄전력도 없는 점,train,사기,동종,공통_동종범죄
6849,이 사건 범행은 누범기간 중 저지른 것인 점,train,사기,누범,공통_동종범죄
6854,동종 사기전력이 있는 점,train,사기,동종,공통_동종범죄
6855,-1999년 이후로 벌금형을 초과하는 범죄 전력이 없다.,train,사기,벌금형,공통_동종범죄
6860,이 사건 각 범행 이전 동종 또는 벌금형을 넘는 처벌전력은 없었던 점 등을 참작하여 형의 집행을 유예하되,train,사기,동종,공통_동종범죄
6862,피고인은 동종 범죄 전력이 없고,train,사기,동종,공통_동종범죄
6862,약 20년 전 저지른 폭력 전과만 있다.,train,사기,전과,공통_동종범죄
6863,피고인이 누범 기간 중에 있고,train,사기,누범,공통_동종범죄
6864,3. 선고형의 결정 : 징역 4개월에 집행유예 1년 아래와 같은 피고인에 대한 양형 정상과 더불어 피고인의 연령,train,사기,집행유예,공통_동종범죄
6865,피고인에게 동종 전과나 벌금형을 넘는 전과가 없는 점 등을 참작하고,train,사기,동종,공통_동종범죄
6866,판시 형법 제37조 후단의 경합범의 관계에 있는 전과를 고려한다고 하더라도,train,사기,전과,공통_동종범죄
6867,피고인은 동종 범행으로 여러 차례 처벌받은 전력이 있음에도 동종 범행으로 인한 집행유예기간이 끝난 후 얼마 되지 않아 다시 이 사건 범행을 저질렀다.,train,사기,동종,공통_동종범죄
6869,○ 유리한 정상: 다른 종류의 범죄로 2회의 가벼운 벌금형을 받은 외에는 전과가 없는 점,train,사기,벌금형,공통_동종범죄
6876,피고인에게 동종 범죄전력이 다수 있는 점,train,사기,동종,공통_동종범죄
6876,동종 범죄전력으로 인한 누범기간 중에 자숙하지 아니하고 재범한 점 등의 불리한 정상이 있으나,train,사기,동종,공통_동종범죄
6883,판시 확정된 전과와 사후적 경합범의 관계에 있어 동시에 판단 받았을 경우와의 형평을 고려하여야 하는 점,train,사기,전과,공통_동종범죄
6883,이 사건 범행 이전에 형사처벌을 받은 전력이 없는 점을 긍정적인 정상으로 참작하고,train,사기,형사처벌,공통_동종범죄
6884,피고인이 초범인 점은 피고인에게 유리한 정상이다.,train,사기,초범,공통_동종범죄
6885,피고인은 이 사건 범행 이전에도 동종 및 이종 범행으로 징역형의 집행유예를 포함하여 여러 차례 처벌받은 전력이 있다.,train,사기,동종,공통_동종범죄
6886,동종 범죄로 2차례 징역형의 처벌을 받은 전력이 있는 점,train,사기,동종,공통_동종범죄
6887,피고인에게 이종 벌금형 3회 외 다른 형사처벌 전력이 없는 점,train,사기,벌금형,공통_동종범죄
6888,피고인이 형사처벌 전력이 없는 초범으로서 이 사건 범행을 인정하면서 반성하고 있는 점,train,사기,형사처벌,공통_동종범죄
6889,○ 불리한 정상: 피고인이 동종 범죄로 여러 차례 처벌받은 전력이 있음에도 다시 이 사건 범행을 저질렀다.,train,사기,동종,공통_동종범죄
6890,피고인은 과거 사기죄 및 횡령죄 등으로 수차례 형사처벌을 받은 전력도 있다.,train,사기,형사처벌,공통_동종범죄
6891,동종 전과가 없고 벌금형을 초과하는 전과가 없는 점 등은 피고인에게 유리한 정상이다.,train,사기,동종,공통_동종범죄
6892,피고인은 동종범죄로 형사처벌을 받은 전력이 수십회에 이르는데도 동종범죄 등으로 인한 누범 기간에 그 성행을 고치지 않고 또다시 이 사건 범행을 저지른 점,train,사기,동종,공통_동종범죄
6893,피고인이 이 사건 범행 이전에 동종범죄로 처벌받은 전력은 없는 점 등을 피고인에게 유리한 정상으로 참작하고,train,사기,동종,공통_동종범죄
6895,동종 전과가 없는 점 등 사정은 인정된다.,train,사기,동종,공통_동종범죄
6896,50억 원 미만(동종경합범이므로 액수 합산),train,사기,동종,공통_동종범죄
6896,징역 1년∼4년(동종경합 합산 결과 1단계 상승으로 형량범위 하한의 1/3 감경),train,사기,동종,공통_동종범죄
6896,과거 동종범행으로 2차례 처벌받은 전력이 있는 점 등에 비춰 죄책이 가볍지 아니하나,train,사기,동종,공통_동종범죄
6896,동종범행은 오래 전 전력인 점 등을 고려하여 주문 기재와 같이 형을 정하고,train,사기,동종,공통_동종범죄
6897,피고인은 누범기간 중 이 사건 범행을 저질렀고,train,사기,누범,공통_동종범죄
6901,동종 범죄로 수회 벌금형 처벌을 받은 전력이 있는 점 등에 비추어 엄한 처벌이 불가피하므로 실형을 선고한다.,train,사기,동종,공통_동종범죄
6903,형사처벌 전력이 전혀 없었던 전과관계 기타 피고인의 연령,train,사기,형사처벌,공통_동종범죄
6904,반면 피고인에게 징역형의 집행유예를 초과하여 형사처벌 받은 전력이나 동종 범행으로 처벌받은 전력은 없는 점은 피고인에게 유리한 정상이다.,train,사기,집행유예,공통_동종범죄
6905,[유리한 정상] 판시 전과와 동시에 판결할 경우와의 형평을 고려해야 한다.,train,사기,전과,공통_동종범죄
6905,피고인은 동종 범행으로 징역형의 실형을 선고받는 등 처벌을 받은 전력이 있음에도 이 사건 각 범행을 또다시 저질렀다.,train,사기,동종,공통_동종범죄
6905,전과 등 이 사건 변론 과정에서 드러난 양형사유들을 종합하여 주문과 같이 형을 정한다.,train,사기,전과,공통_동종범죄
6906,[유리한 정상] 피고인에게 동종 전과 없다.,train,사기,동종,공통_동종범죄
6908,피고인이 이 사건 범행을 저지르기 전에는 동종범죄로 처벌받거나 벌금형보다 무겁게 처벌받은 전력이 없는 점,train,사기,동종,공통_동종범죄
6909,피고인이 일부 범행을 자백하고 있으며 초범인 점,train,사기,초범,공통_동종범죄
6911,비록 벌금형이기는 하나 피고인은 이미 동종 범행을 저질러 여러 차례 처벌받은 적 있는 점,train,사기,벌금형,공통_동종범죄
6912,초범인 점 등의 유리한 정상,train,사기,초범,공통_동종범죄
6916,피고인이 판시 전과로 인한 집행유예기간 중에 자중하지 않고 이 사건 각 범행을 저질렀으며(다만,train,사기,전과,공통_동종범죄
6916,현재 위 집행유예기간은 도과하였다),train,사기,집행유예,공통_동종범죄
6920,판시 전과를 포함하여 사기죄로 처벌받은 전력이 수차례 있는 점,train,사기,전과,공통_동종범죄
6921,- 피고인은 형사처벌 전력이 없는 초범이다.,train,사기,형사처벌,공통_동종범죄
6924,피고인이 여러 차례 동종범죄로 처벌받은 전력이 있음에도 이 사건 범행을 한 점,train,사기,동종,공통_동종범죄
6925,초범인 점 등 기록과 이 사건 변론에 나타난 여러 가지 양형의 조건을 종합하여 주문과 같이 형을 정한다.,train,사기,초범,공통_동종범죄
6927,피고인에게 동종 범죄를 포함한 여러 범죄로 형사처분을 받은 전력이 있는 점은 양형상 불리한 사유이다.,train,사기,동종,공통_동종범죄
6927,피고인의 범죄전력 중 사기 범행은 벌금형을 선고받은 것 하나에 그치고,train,사기,벌금형,공통_동종범죄
6927,벌금형을 초과하는 형사처분을 받은 때는 현재로부터 30년도 더 전인 점 등을 고려하면,train,사기,벌금형,공통_동종범죄
6928,이종 범죄로 1회 벌금형 처벌을 받은 전력만 있다.,train,사기,벌금형,공통_동종범죄
6929,동종 범행으로 한 차례 약식명령을 받은 바 있고,train,사기,동종,공통_동종범죄
6930,초범이며,train,사기,초범,공통_동종범죄
6932,피고인에게 동종 전과가 많고 동종 범죄로 인한 누범기간 중에 이 사건 범행을 행한 점,train,사기,동종,공통_동종범죄
6933,피고인이 이미 같은 수법의 사기범행으로 형사처벌을 받은 전력이 있고,train,사기,형사처벌,공통_동종범죄
6933,특히 2019. 5. 10. 사기죄로 징역 10월 및 집행유예 2년을 선고받아 그 항소심이 계속 중인 상태에서 동일한 수법의 이 사건 사기범행을 저질렀으므로 죄질이 매우 좋지 않다.,train,사기,집행유예,공통_동종범죄
6935,벌금형을 초과하여 처벌받은 전력이나 동종의 전력이 없는 점을 유리한 정상으로 고려하고,train,사기,벌금형,공통_동종범죄
6936,[일반양형인자] - 감경요소: 형사처벌 전력 없음,train,사기,형사처벌,공통_동종범죄
6936,[집행유예 참작사유] - 주요긍정사유: 형사처벌 전력 없음,train,사기,집행유예,공통_동종범죄
6938,누범 기간 중임에도 반복하여 범행을 저지른 점,train,사기,누범,공통_동종범죄
6939,동종경합범 처리방법에 따라 이득액을 합산),train,사기,동종,공통_동종범죄
6939,특히 피고인은 피고인 명의의 계좌를 제공하였다가 보이스피싱 범행에 사용되어 조사를 받고 전자금융거래법위반죄로 벌금형을 받은 전력이 있고(증거기록 84,train,사기,벌금형,공통_동종범죄
6939,판시 범죄사실 기재와 같이 보이스피싱 관련 사기방조죄로 집행유예의 선처를 받았음에도,train,사기,집행유예,공통_동종범죄
6939,그로부터 2개월이 채 지나기 전 집행유예 기간 중에 보이스피싱 범죄에서 ‘수거책’ 역할을 하였으므로,train,사기,집행유예,공통_동종범죄
6940,피고인이 이 사건 범행 이전에 동종 범죄로 처벌받은 전력은 없는 점 그 밖에 피고인의 나이,train,사기,동종,공통_동종범죄
6944,집행유예 이상으로 처벌받은 전력은 없는 점 등을 참작한다.,train,사기,집행유예,공통_동종범죄
6944,피해자는 과거 C 카지노에서 무등록 대부업을 하였다는 이유로 형사처벌을 받기도 한 점,train,사기,형사처벌,공통_동종범죄
6945,피고인이 도로교통법위반(음주운전)죄로 1회 벌금형을 선고받은 외에 달리 처벌받은 전과나 전력이 없는 점,train,사기,벌금형,공통_동종범죄
6946,피고인에게 동종 내지 벌금형을 초과하는 처벌 전력은 없는 점 등(이와 같은 유리한 정상들을 감안하여 피고인에 대한 구속영장 발부는 하지 아니함),train,사기,동종,공통_동종범죄
6947,초범인 점 등을 유리한 정상으로 삼고 피고인의 연령,train,사기,초범,공통_동종범죄
6949,이 사건 이전에 동종 범죄로 형사처벌을 받은 전력이 없는 점 등 피고인에게 유리한 정상이 있는 반면에,train,사기,동종,공통_동종범죄
6951,이 사건 범행 전에는 동종 범죄로 처벌받은 전력이 없고,train,사기,동종,공통_동종범죄
6955,(동종 범행으로 처벌받은 전력이 다수 있고,train,사기,동종,공통_동종범죄
6955,동종 범행으로 징역형을 복역하고 출소한 때로부터 불과 한 달이 채 지나기 전에 또다시 이 사건 범행을 저질렀으므로,train,사기,동종,공통_동종범죄
6956,2003년경에도 사기죄로 벌금형을 받은 전력이 있는 점,train,사기,벌금형,공통_동종범죄
6956,판시 전과를 제외하면 벌금형을 넘는 전과는 없는 점,train,사기,전과,공통_동종범죄
6959,판시 도로교통법위반(음주운전)죄의 확정전과가 있는바 함께 처벌받았을 경우의 형평성을 고려해야 하는 점,train,사기,전과,공통_동종범죄
6960,동종 범죄로 2013년 징역형의 집행을 유예하는 처벌을 받은 전력이 있는 점,train,사기,동종,공통_동종범죄
6962,동종 범행전력이 없다.,train,사기,동종,공통_동종범죄
6963,○ 불리한 정상: 사기죄로 몇 차례 벌금형 등을 받은 전력이 있는 점,train,사기,벌금형,공통_동종범죄
6963,○ 유리한 정상: 최근 약 5년 사이에는 아무런 전과가 없는 점,train,사기,전과,공통_동종범죄
6965,피고인이 징역형을 포함하여 동종범죄로 수회 형사처벌 받은 전력이 있고 그로 인한 누범기간중이었음에도 다시 이 사건 범행을 저지른 점,train,사기,동종,공통_동종범죄
6966,피고인이 종전에 동종 범죄로 처벌받은 전력이 없는 점,train,사기,동종,공통_동종범죄
6968,피고인에게 동종 전과는 없는 점 등 제반사정을 고려하여 주문과 같이 형을 정한다.,train,사기,동종,공통_동종범죄
6970,피고인이 누범기간 중 이 사건 범행을 저지른 점,train,사기,누범,공통_동종범죄
6970,동종 범죄전력이 다수 있음에도 유사한 수법으로 재범한 점은 불리한 정상이다.,train,사기,동종,공통_동종범죄
6971,피고인이 동종범죄로 인한 누범기간 중에 거액을 편취하였고,train,사기,동종,공통_동종범죄
6971,현재까지 피해자의 피해도 회복시켜주지 못하고 있을 뿐 아니라 피고인에게 동종범죄 전력도 다수 있으므로,train,사기,동종,공통_동종범죄
6973,- 감경요소 : 형사처벌 전력 없음,train,사기,형사처벌,공통_동종범죄
6973,- 주요긍정사유 : 형사처벌 전력 없음,train,사기,형사처벌,공통_동종범죄
6974,피고인에게 근로기준법위반으로 인한 벌금형 1회 외 별다른 처벌 전력이 없는 점,train,사기,벌금형,공통_동종범죄
6977,피고인에게 이 사건 범행 이전에 별다른 범죄전력이 없다.,train,사기,전력이 없다,공통_동종범죄
6978,피고인이 벌금형 전과 외에 실형으로 처벌받은 전력이 없는 점은 인정되나,train,사기,벌금형,공통_동종범죄
6978,피고인이 동종범죄로 처벌받은 전력이 있는 점,train,사기,동종,공통_동종범죄
6979,○ 불리한 정상: 피고인은 수회 동종범죄로 처벌받은 전력이 있음에도 불구하고 누범기간 중에 자중하지 아니하고 또다시 이 사건 범행을 저지른 점,train,사기,동종,공통_동종범죄
6980,피해자가 피고인에 대해 집행유예 이상의 처벌을 원하지 않는다고 강하게 탄원한 점 참작.,train,사기,집행유예,공통_동종범죄
6982,피고인에게 징역형의 실형을 포함하여 동종 범죄로 형사처벌 받은 전력이 3회 있고,train,사기,동종,공통_동종범죄
6982,그 외에도 이종 범죄로 형사처벌 받은 전력이 다수 있다.,train,사기,형사처벌,공통_동종범죄
6983,피고인이 동종 전력으로 실형을 복역한 적이 있음에도 재차 이 사건 범행을 하였을 뿐 아니라,train,사기,동종,공통_동종범죄
6983,피고인의 동종전력이 약 20여년 이상 전의 것인 점 등 이 사건 기록에 나타난 제반 사정을 종합하여 주문과 같이 형을 정한다.,train,사기,동종,공통_동종범죄
6986,피고인에게 동종 범죄전력이 없는 점은 유리한 정상이다.,train,사기,동종,공통_동종범죄
6987,또한 보이스피싱 범죄는 형사처벌을 피하기 위하여 점조직의 형태로 운영되고 있어 범죄에 가담한 자들을 검거하는 것이 쉽지 않고,train,사기,형사처벌,공통_동종범죄
6987,피고인이 형사처벌을 받은 전력이 없는 초범인 점 등 유리한 정상을 참작하고,train,사기,형사처벌,공통_동종범죄
6988,형사처벌 전력이 전혀 없는 초범인 점,train,사기,형사처벌,공통_동종범죄
6990,피고인이 근로기준법위반 범행으로 벌금형의 처벌을 받은 것 외에는 형사처벌 전력이 없는 점,train,사기,벌금형,공통_동종범죄
6993,그 외에 1993. 4.경 향토예비군설치법위반죄로 벌금 10만 원의 처벌 전력만 있고 달리 전과 없는 점은 유리한 정상으로 참작한다.,train,사기,전과,공통_동종범죄
6994,판결이 확정된 판시 전과와 동시에 판결할 경우와의 형평을 고려한다.,train,사기,전과,공통_동종범죄
6997,피고인은 이 사건 범행 당시 사행행위등규제및처벌특례법위반죄로 인한 집행유예 기간 중이었던 점 등은 불리한 정상이다.,train,사기,집행유예,공통_동종범죄
6999,- 일반부정사유: 동종 전과가 있거나 2회 이상 집행유예 이상 전과,train,사기,동종,공통_동종범죄
6999,다수의 동종전과가 있는 점 등은 불리한 정상이다.,train,사기,동종,공통_동종범죄
7002,피고인에게 동종 범죄로 처벌받은 전력 및 벌금형을 초과하는 처벌 전력은 없는 점,train,사기,동종,공통_동종범죄
7006,피고인은 아직 범죄전력이 없는 초범이다.,train,사기,초범,공통_동종범죄
7009,피고인은 소년보호처분을 받은 이외에는 형사처벌을 받은 전력이 없다.,train,사기,형사처벌,공통_동종범죄
7012,피고인이 1997년경 이후 벌금형보다 중한 처벌을 받은 전력은 없는 점,train,사기,벌금형,공통_동종범죄
7015,동종 집행유예 기간 중에 저지른 범죄인 점 등은 불리한 양형요소이다.,train,사기,동종,공통_동종범죄
7018,벌금형을 초과하여 처벌받은 전력은 없다는 점 등은 유리한 정상으로 고려한다.,train,사기,벌금형,공통_동종범죄
7019,피고인이 이 사건 이전에 처벌받은 전력이 6회에 이르고 그중 5회가 이 사건과 동종의 범죄로 처벌받은 것인 점,train,사기,동종,공통_동종범죄
7019,피고인이 동종의 범죄로 인한 집행유예기간 중에 이 사건 각 범행을 범한 점,train,사기,동종,공통_동종범죄
7020,동종 전과가 다수 있는 점,train,사기,동종,공통_동종범죄
7022,다만 피고인에게 벌금형보다 무거운 처벌을 받은 전력은 없는 점을 참작하고,train,사기,벌금형,공통_동종범죄
7024,벌금형 1회 외에는 특별한 처벌전력 없는 점 등을 참작하여 주문과 같이 형을 정함.,train,사기,벌금형,공통_동종범죄
7028,○ 유리한 정상: 1회의 벌금형 처벌전력 외에는 별다른 형사처벌 전력이 없다.,train,사기,벌금형,공통_동종범죄
7029,동종 범죄전력이 없는 점 등 피고인에게 유리한 정상들도 참작하고,train,사기,동종,공통_동종범죄
7030,벌금형 초과 전과 없는 점,train,사기,벌금형,공통_동종범죄
7030,동종 벌금 전과 1회 있는 점 등,train,사기,동종,공통_동종범죄
7031,피고인이 동종 범행으로 징역형의 실형으로 처벌받은 전력이 있음에도 또다시 사기 범행을 저질렀는바,train,사기,동종,공통_동종범죄
7031,이 사건 각 범행은 판시 전과와 형법 제37조 후단 경합범 관계에 있어 동시에 판결할 경우의 형평을 고려해야 하는 점,train,사기,전과,공통_동종범죄
7032,형사처벌 받은 전력이 없는 초범인 점,train,사기,형사처벌,공통_동종범죄
7033,피고인이 사기죄로 벌금형 4회,train,사기,벌금형,공통_동종범죄
7033,징역형의 집행유예 1회 선고를 받은 전력이 있는 점,train,사기,집행유예,공통_동종범죄
7034,범행 후의 정황 등 형법 제51조에 정해진 양형 조건을 종합적으로 고려하여 약식명령의 벌금형보다 적은 액수의 벌금형을 선고한다.,train,사기,벌금형,공통_동종범죄
7036,피고인은 동종 범죄로 징역형의 실형 한 차례,train,사기,동종,공통_동종범죄
