id,sentence,dataSplit,casename,matched,ruleType
6541,기소된 후인 2021. 5. 28. 피해자와 합의한 점,train,사기,합의,공통_합의
6549,일부 피해자들과 합의한 점,train,사기,합의,공통_합의
6551,이 사건 피해금액이 1억 원에 이르고 일부 금액<각주1>을 제외하고는 대부분의 피해가 회복되지 않았으며 피해자가 피고인을 엄하게 처벌해 줄 것을 탄원하고 있으므로,train,사기,탄원,공통_합의
6552,피해자 F이 피고인에 대한 처벌을 원하지 않고 있는 점,train,사기,원하지,공통_합의
6553,피고인은 피해자와 합의에 이르지 못하였다.,train,사기,합의,공통_합의
6554,피해자로부터 용서를 받지도 못한 점,train,사기,용서,공통_합의
6561,피고인이 범행 시인하고 피해금액이 그리 크지 않으며 피해자와 원만히 합의한 유리한 사정이 있다.,train,사기,합의,공통_합의
6563,피고인은 대출금채권을 양수한 O 주식회사와 원만히 합의한 점,train,사기,합의,공통_합의
6567,종전 사기범행으로 재판받는 중에 다른 사기 피해자들에 대한 형사합의금 마련을 위해 무리하게 사업을 추진하면서 피해자들을 유인함으로써 이 사건 범행에 이른 것으로 보이는바,train,사기,합의,공통_합의
6568,○ 유리한 정상 : 피고인이 피해회사와 합의하여 피해회사가 처벌을 원하지 아니하는 의사를 표시하고 있다.,train,사기,합의,공통_합의
6570,피해자와 원만히 합의하여 피해자가 피고인의 처벌을 원하고 있지 않다.,train,사기,합의,공통_합의
6572,피해액이 상당함에도 피고인이 피해회복을 하거나 피해자로부터 용서받지 못한 점,train,사기,용서,공통_합의
6578,I과 피해금액을 변제하고 합의하여 위 피해자들이 피고인에 대한 처벌을 바라지 않고 있다.,train,사기,합의,공통_합의
6579,다만 범행 인정하고 피해자 J을 제외한 나머지 피해자들과 합의하여 이들이 처벌을 바라지 않는다.,train,사기,합의,공통_합의
6584,피해자 부부가 피고인에 대한 선처를 탄원하고 있는 점은 참작할 만한 정상이다.,train,사기,선처,공통_합의
6584,그뿐만 아니라 피고인은 피해자로부터 앞으로 피해회복을 해주는 조건으로 합의서를 작성받아 재판부에 제출한 다음,train,사기,합의,공통_합의
6584,피해자에게 돈을 송금하여 마치 그 합의사항을 이행한 것처럼 송금확인증을 만들어 이를 재판부에 제출한 후 즉시 그 돈을 모두 돌려받음으로써 실제 피해회복은 전혀 하지 않았다.,train,사기,합의,공통_합의
6588,피해자와 합의하여 용서를 받았고,train,사기,합의,공통_합의
6588,피해자가 피고인에 대한 선처를 탄원하는 점,train,사기,선처,공통_합의
6591,피해자의 피해금이 일부라도 변제되거나 피고인이 피해자로부터 용서받지도 못하였다.,train,사기,용서,공통_합의
6596,피해자 E와는 합의하였다.,train,사기,합의,공통_합의
6605,피고인이 아직 피해자와 합의하지 못하였다.,train,사기,합의,공통_합의
6606,이 사건 범행 후 10년이 넘도록 피해자들로부터 용서받거나 피해회복하지 아니한 채 잠적한 점 감안할 때 그 죄책에 상응하는 엄중한 처벌이 불가피하다.,train,사기,용서,공통_합의
6609,피고인이 피해자와 원만히 합의하여 피해자가 피고인에 대한 처벌을 원하지 않는다.,train,사기,합의,공통_합의
6621,피고인이 일부 피해자들과 합의한 점(피해자 B의 공소사실 기재 피해금액은 2,train,사기,합의,공통_합의
6624,피해자들과 합의되지 않고 피해회복도 이루어지지 않은 점은 불리한 정상이다.,train,사기,합의,공통_합의
6627,일부 피해자와 합의하였다.,train,사기,합의,공통_합의
6627,일부 피해자들로부터 용서를 받지 못하였다.,train,사기,용서,공통_합의
6628,D으로부터 용서받지 못하였다.,train,사기,용서,공통_합의
6637,피고인의 범행으로 인해 피해자가 개인회생신청에 이르는 등 피해자에게 심각한 피해가 발생하였음에도 피해회복이 이루어지거나 피해자와 합의되지 않은 점 등을 고려할 때 피고인에게는 실형을 선고하기로 하되,train,사기,합의,공통_합의
6641,피고인이 피해자 F과 합의하여 위 피해자가 피고인에 대한 처벌을 원하지 않는 점,train,사기,합의,공통_합의
6641,피고인이 피해자들에게 아무런 피해회복을 해 주지 못하였고 피해자 F 이외에는 피해자들과 합의하지 못한 점 및 그 밖에 피고인의 연령,train,사기,합의,공통_합의
6644,이에 피해자가 피고인의 선처를 탄원하고 있다.,train,사기,선처,공통_합의
6649,피고인은 피해자와 원만히 합의하여 피해자는 피고인에 대한 처벌을 원하지 않고 있다.,train,사기,합의,공통_합의
6650,피해자와 합의를 하거나 그 피해를 회복하지도 못하였으므로 죄책이 무겁다.,train,사기,합의,공통_합의
6652,피해자에게 250만 원을 지급하고 합의한 점과 아울러 형이 확정된 판시 사기죄와 동시에 판결할 경우와의 형의 균형 등을 고려하여 주문 기재와 같이 형을 정한다.,train,사기,합의,공통_합의
6660,다만 피해자가 피고인의 선처를 바라고 있는 점,train,사기,선처,공통_합의
6666,- 불리한 정상: 피해자와 합의하지 아니한 점,train,사기,합의,공통_합의
6668,피해회사가 처벌을 원하지 않는 점,train,사기,원하지,공통_합의
6670,피해자들과 합의에 이르지 못한 점,train,사기,합의,공통_합의
6675,피해자와 합의되어 피해자가 처벌을 원하지 않고 있는 점은 유리한 정상으로 참작하고 그 밖에 피고인의 연령,train,사기,합의,공통_합의
6676,피해자 D와 원만히 합의하였으며,train,사기,합의,공통_합의
6678,연락이 닿은 피해자들 대부분과 합의하였고,train,사기,합의,공통_합의
6678,위 피해자들은 피고인에 대한 처벌을 원하지 않고 있으며,train,사기,원하지,공통_합의
6678,특히 가장 많은 액수의 피해를 입은 피해자는 이 법정에 증인으로 출석까지 하여 피고인으로부터 일시금으로 합의금 일부를 지급받았고,train,사기,합의,공통_합의
6678,피고인에 대한 선처 바란다는 취지로 호소하기도 한 점,train,사기,선처,공통_합의
6678,피고인의 가족들이 피고인에 대한 선처를 호소하고 있고,train,사기,선처,공통_합의
6680,피고인이 피해금액 중 50% 이상을 변제하고 나머지도 분할 변제를 약속하며 피해자와 원만하게 합의하여 피해자가 피고인에 대한 처벌을 원하지 않는 점,train,사기,합의,공통_합의
6684,다만 피고인이 이 사건 범행을 인정하고 반성하면서 이 사건 피해 회복을 위해 노력한 결과 피해자와 합의하여 피해자가 피고인의 처벌을 원하지 않는 점,train,사기,합의,공통_합의
6687,그럼에도 현재까지 피해 회복이 대부분 이루어지지 않았고<각주1>피해자로부터 용서받지도 못한 점 등은 피고인에게 불리한 정상이다.,train,사기,용서,공통_합의
6688,피해자로부터 용서받지도 못하였으며,train,사기,용서,공통_합의
6695,피해자가 피고인의 처벌을 원하지 않는 점을 주요 양형사유로 참작하고,train,사기,원하지,공통_합의
6696,피해자와 합의(총 4,train,사기,합의,공통_합의
6696,800만 원은 2020. 6.부터 매월 30만 원씩 분할 지급)하여 피해자가 피고인에 대한 처벌을 원하지 않는 의사를 표시하였다.,train,사기,원하지,공통_합의
6696,비록 합의하였으나 아직까지 많은 부분이 실질적으로 피해가 회복되지 않았다.,train,사기,합의,공통_합의
6699,피해자와의 합의 등 이 사건 변론에 나타난 여러 정상을 종합하여 주문과 같이 형을 정한다.,train,사기,합의,공통_합의
6709,Y과 합의하여 상당 부분 피해 회복이 되었으나,train,사기,합의,공통_합의
6709,나머지 피해자들과 합의한 바 없다.,train,사기,합의,공통_합의
6710,범행 후 상당한 기간이 지났음에도 피해의 대부분이 회복되지 않았고 현재까지 피해자들로부터 용서를 받지 못한 점 등에 비추어 보면,train,사기,용서,공통_합의
6711,피고인이 피해의 일부를 변제하고 피해자로부터 용서받았다.,train,사기,용서,공통_합의
6712,피해자 B를 제외한 나머지 피해자들과 합의하여 위 피해자들이 피고인에 대한 처벌을 원하지 않는다(피해자 B의 경우 피해자가 연락처 등 개인정보 제공을 거절하여 합의에 이르지 못한 사정이 있는 것으로 보인다). 피고인이 처음에는 확정적 고의가 아닌 미필적 고의 하에 범행에 가담한 것으로 보이고,train,사기,합의,공통_합의
6716,피해자가 피고인의 엄벌을 탄원하고 있는 점,train,사기,탄원,공통_합의
6719,피해변제나 합의가 이루어지지 않은 점은 불리한 양형요소로,train,사기,합의,공통_합의
6720,피해자와 합의하여 피해자가 피고인의 처벌을 원치 않는 점,train,사기,합의,공통_합의
6734,피해회복이 이루어져 피해자가 피고인의 처벌을 원하지 않고 있다.,train,사기,원하지,공통_합의
6738,변론종결 이후 피해액을 변제하고 피해자와 원만히 합의한 점,train,사기,합의,공통_합의
6739,피해자와 원만히 합의하여 피해자가 피고인의 처벌을 원하지 않는 점 등,train,사기,합의,공통_합의
6743,L와 합의하였다.,train,사기,합의,공통_합의
6743,피해자 Q이 피고인에 대한 엄벌을 탄원하고 있다.,train,사기,탄원,공통_합의
6752,피해자와 완전한 합의에 이르렀다거나 피해자로부터 용서를 받았다고 볼 만한 정황이 없으며,train,사기,합의,공통_합의
6754,○ 불리한 정상 : 피해자와 합의되지 않은 점,train,사기,합의,공통_합의
6755,피고인이 뒤늦게나마 피해자와 합의한 점(피고인은 피고인의 처가 피해자에게 1억 2,train,사기,합의,공통_합의
6758,피고인이 피해자들과 합의하여 피해자들이 피고인의 처벌을 원하지 않는다는 의사를 밝힌 점,train,사기,합의,공통_합의
6763,피고인이 피해자들과 원만히 합의한 점(2021. 12. 7. 이 법원에 제출된 각 합의서),train,사기,합의,공통_합의
6767,피고인이 피해자들로부터 용서받지 못하였다.,train,사기,용서,공통_합의
6777,피해자들과 합의하였고,train,사기,합의,공통_합의
6777,피해자들이 처벌을 원하지 않고 있다.,train,사기,원하지,공통_합의
6778,피해자는 이를 양형에 고려하여 달라고 탄원하고 있다.,train,사기,탄원,공통_합의
6778,000만 원을 지급받은 후 합의서를 작성하여 준 점 등을 참작하고,train,사기,합의,공통_합의
6780,편취금액이 크고 피해자와 합의하지 못하였으나 추후 건물분양 등을 통해 피해자의 피해가 회복될 여지가 큰 점,train,사기,합의,공통_합의
6787,편취 규모가 상당함에도 피고인이 피해자와 합의에 이르지 못했다.,train,사기,합의,공통_합의
6790,피고인은 피해자와 합의에 이르지 못하였으며,train,사기,합의,공통_합의
6796,이 사건 범행 후 상당한 시간이 지났음에도 불구하고 피고인이 피해자에게 온전한 피해 회복을 해주지 않은 점(2021. 6. 21.자 합의서에는 피고인이 피해자에게 2,train,사기,합의,공통_합의
6796,변호인 의견서 등의 기재에 따르면 위 합의서의 내용은 공소 외 F이 피해자에게 2,train,사기,합의,공통_합의
6799,피해자와 합의가 이루어지지 아니한 점 등,train,사기,합의,공통_합의
6800,이후 재판 과정에서 추가로 돈을 더 지급하고 피해자와 원만히 합의하였다.,train,사기,합의,공통_합의
6801,이 사건 공소제기 이후 피해변제 등을 통하여 피해자와 원만하게 합의하였다.,train,사기,합의,공통_합의
6804,피해자가 피고인의 엄벌을 탄원하고 있고 피해액 중 상당 부분이 회복되지 않은 점을 감안할 때 피고인에 대한 실형 선고는 불가피하다.,train,사기,탄원,공통_합의
6805,범행 후의 정황(피해자와 합의하여 피해자가 피고인에 대한 처벌을 원하지 아니한다는 의견을 표시함) 등 이 사건 공판절차 과정에 나타난 제반 양형조건을 참작하여,train,사기,합의,공통_합의
6807,피해자와 원만하게 합의하여 위 피해자가 피고인의 처벌을 원하지 않는다.,train,사기,합의,공통_합의
6813,피해자와 합의한 사정이 없다.,train,사기,합의,공통_합의
6814,피해가 전혀 회복되지 않았고 피해자들과도 합의하지 못한 점 등 불리한 정상과 피고인이 범행을 모두 인정한 점 등 유리한 정상,train,사기,합의,공통_합의
6816,피해자로 용서받지 못하였으며,train,사기,용서,공통_합의
6816,용서받기 위하여 진지한 노력을 하였다고 볼 자료도 없다.,train,사기,용서,공통_합의
6818,피해자들은 피고인의 선처를 탄원하고 있다.,train,사기,선처,공통_합의
6821,피해자는 피고인과 원만히 합의하였다.,train,사기,합의,공통_합의
6822,피고인은 현재까지도 피해자와 합의하지 아니하였고,train,사기,합의,공통_합의
6822,이에 피해자는 피고인의 엄벌을 탄원하고 있다.,train,사기,탄원,공통_합의
6828,현재까지 피해자로부터 용서를 받지 못한 점 등에 비추어 보면,train,사기,용서,공통_합의
6831,피고인이 현재까지 피해자들과 합의하지 못하였고,train,사기,합의,공통_합의
6832,게다가 피고인은 피해자와 합의하거나 피해를 회복하지도 아니하였고,train,사기,합의,공통_합의
6837,피고인이 피해자에게 용서받지 못한 점 등,train,사기,용서,공통_합의
6839,피해가 회복되지 않았고 피해자들로부터 용서받지 못한 점,train,사기,용서,공통_합의
6841,피해 회복 및 합의의 기회를 주기 위하여 법정구속은 하지 않는다.,train,사기,합의,공통_합의
6843,피해자가 엄벌을 탄원하고 있는 점 등 불리한 정상,train,사기,탄원,공통_합의
6845,피해가 거의 회복되지 아니하였고 피해자와 합의되지도 아니한 점,train,사기,합의,공통_합의
6849,BM에게 450만 원을 각 지급하고 합의하여 위 피해자들이 피고인의 처벌을 원하지 아니하는 점,train,사기,합의,공통_합의
6851,피해가 회복되지 아니하였고 피해자들과 합의되지 아니한 점,train,사기,합의,공통_합의
6860,별지 범죄일람표 3. 기재 각 피해자들에 대한 피해가 회복되어 해당 피해자들이 피고인에 대한 처벌을 원하지 않는 점,train,사기,원하지,공통_합의
6860,000만 원을 지급하고 합의하여 위 피해자가 피고인에 대한 처벌을 원하지 않는 점,train,사기,합의,공통_합의
6864,미변제 한 돈은 분할하여 변제하기로 약속하는 방법으로 피해 회복을 위해 노력하여 피해자가 피고인의 처벌을 원하지 않는 점,train,사기,원하지,공통_합의
6875,피해자가 피해액 중 절반이 넘는 돈을 배상받았다.,train,사기,배상,공통_합의
6875,피해액수 및 배상된 금액,train,사기,배상,공통_합의
6876,피해자와 원만히 합의하여 피해자가 피고인의 처벌을 원하지 않고 있는 점 등의 유리한 정상과 그 밖에 피고인의 연령,train,사기,합의,공통_합의
6881,750만 원으로 많고 피해자와 합의하지 않은 점,train,사기,합의,공통_합의
6883,다만 피고인이 이 사건 공소제기 후 피해자에게 피해금액을 모두 변제하여 피해자가 피고인에 대한 처벌을 원하지 아니하는 점,train,사기,원하지,공통_합의
6884,피해자들이 피고인에 대한 엄벌을 탄원하는 점을 비롯하여 피고인의 나이,train,사기,탄원,공통_합의
6886,한편 피해자와 합의하였고,train,사기,합의,공통_합의
6887,피해자와 합의하지 못한 점 등 불리한 정상이 있으나,train,사기,합의,공통_합의
6888,피고인이 피해자에게 300만 원을 지급하고 피해자와 합의하여 피해자가 피고인에 대한 처벌을 원하지 않고 있는 점,train,사기,합의,공통_합의
6888,피고인의 가족과 지인들 다수가 피고인에 대한 선처를 탄원하는 등 사회적 유대관계가 비교적 분명해 보이는 점을 유리한 정상으로 참작한다.,train,사기,선처,공통_합의
6890,피고인은 피해자와 합의하여 피해자가 피고인의 처벌을 원하지 않고 있다.,train,사기,합의,공통_합의
6891,한편 피해자와 합의하지 못한 점,train,사기,합의,공통_합의
6893,피고인이 이 사건 범행으로 얻은 이익이 편취금액보다 적음에도 피해자에게 편취금 전부를 변제하고 용서를 구하여 피해자가 피고인에 대한 처벌을 원하지 않는 점,train,사기,용서,공통_합의
6897,피해자는 이 사건 범행으로 인한 재산적 고통을 호소하며 피고인의 엄벌을 탄원하고 있다.,train,사기,탄원,공통_합의
6899,피고인이 피해자에게 피해원금을 초과하여 변제하여 피해자와 합의함에 따라 피해자가 피고인의 처벌을 원하지 않는 점,train,사기,합의,공통_합의
6901,피해자와의 합의나 피해회복이 이루어지지 않은 점,train,사기,합의,공통_합의
6901,추후 피해자와의 합의 내지 피해회복의 여지가 있다고 보여 법정구속은 하지 아니한다).,train,사기,합의,공통_합의
6903,그럼에도 현재까지 전혀 변제가 이루어지지 않아 피해자로부터 용서받지 못한 점 등을 고려하여 징역형으로 처벌하되,train,사기,용서,공통_합의
6907,피고인이 피해회복을 위한 상당한 조치를 취하여 피해자가 이 법원에 피고인의 처벌을 원하지 않는다는 의사를 밝힌 점,train,사기,원하지,공통_합의
6908,피해가 회복되지 아니하여 피해자가 피고인에 대하여 엄벌을 탄원하고 있는 점 등은 피고인에게 불리한 정상에 해당한다.,train,사기,탄원,공통_합의
6909,피고인이 피해자와 원만히 합의한 점 등을 피고인에게 유리한 정상으로 참작하고,train,사기,합의,공통_합의
6912,일부 피해금액을 지급하고 피해자들 모두와 합의하는 등 피해 회복을 위해 노력한 점,train,사기,합의,공통_합의
6916,피해자들과 합의하거나 각 피해를 회복시키지 아니한 점,train,사기,합의,공통_합의
6916,피고인에게 마지막으로 피해 변제 및 합의의 기회를 주기 위하여 법정구속은 하지 아니한다.,train,사기,합의,공통_합의
6921,- 피고인이 피해자들과 합의하지 못하였고,train,사기,합의,공통_합의
6922,공소제기 이후 피해자들과 모두 원만히 합의한 점,train,사기,합의,공통_합의
6927,피고인이 최종적으로 피해자와 합의한 점,train,사기,합의,공통_합의
6931,합의에 이르지 못한 피해자들이 많은 점을 고려하면,train,사기,합의,공통_합의
6935,피해자와 합의하지도 못한 점을 고려하면 피고인에게 실형의 선고가 불가피하다.,train,사기,합의,공통_합의
6941,피해회복을 위한 노력을 지속적으로 기울여 피해금 중 일부를 변제하였고 피해자들 모두가 피고인에 대한 처벌을 원하지 않고 있는 점,train,사기,원하지,공통_합의
6945,피해자 중 ○○공제조합과는 합의가 되었고,train,사기,합의,공통_합의
6950,편취금액이 고액임에도 피해자와 합의가 이루어지지 않은 점은 불리한 양형요소이고,train,사기,합의,공통_합의
6956,○ 유리한 정상: 피해자와 원만히 합의한 점,train,사기,합의,공통_합의
6963,완전한 피해회복이 되지 않았고 피해자로부터 용서도 받지 못한 점,train,사기,용서,공통_합의
6965,피고인이 피해자에게 피해금액 일부를 지급하고 합의하여 피해자가 피고인에 대한 처벌을 원하지 않고 있는 점 등은 유리한 정상이다.,train,사기,합의,공통_합의
6967,피해자가 피고인과 합의하여 피고인에 대한 처벌을 원하지 않고 있다.,train,사기,합의,공통_합의
6973,- 주요부정사유 : 미합의,train,사기,합의,공통_합의
6976,피해자가 피고인으로부터 피해금을 변제받아 피고인의 선처를 구하고 있는 점,train,사기,선처,공통_합의
6978,피해자 D은 피고인의 엄벌을 탄원하고 있는 점,train,사기,탄원,공통_합의
6982,m 유리한 정상: 피해자와 합의하여 피해자가 피고인의 처벌을 원치 않는다.,train,사기,합의,공통_합의
6982,피고인이 피해자에게 손해배상금으로 8,train,사기,배상,공통_합의
6983,다만 피고인이 편취한 금액 상당의 금원을 피해자에게 변제하여 피해자가 피고인의 처벌을 원하지 아니하는 점,train,사기,원하지,공통_합의
6986,피고인이 피해 회복을 위해 노력하여 피해자와 합의한 점,train,사기,합의,공통_합의
6987,그럼에도 피고인은 피해자들과 합의한 사실이 없고,train,사기,합의,공통_합의
6987,피해자들로부터 범행에 대하여 용서를 받지도 못하였다.,train,사기,용서,공통_합의
6989,피해자는 피고인의 처벌을 원하지 않고 있다.,train,사기,원하지,공통_합의
6993,피해자들이 엄한 처벌을 탄원하고 있는 점은 불리한 정상으로,train,사기,탄원,공통_합의
6997,변론종결 이후 피해자와 합의한 점,train,사기,합의,공통_합의
6999,피해자들에 대한 피해회복을 위해 노력하여 합의에 이른 점 등 유리한 정상도 인정되는바,train,사기,합의,공통_합의
7002,피해자와의 합의나 피해회복도 이루어지지 않았다.,train,사기,합의,공통_합의
7006,피고인이 피해 회복을 위하여 노력하여 피해자들과 원만히 합의하였다.,train,사기,합의,공통_합의
7007,기소 후 피해 금액을 전액 변제하고 피해자와 합의한 점,train,사기,합의,공통_합의
7010,서○○의 누나 명의로 인수된 신라궁펜션의 인수계약은 합의해제되었고,train,사기,합의,공통_합의
7017,피해자와 원만히 합의되어 피해자가 고소를 취하한 점 등을 참작한다.,train,사기,합의,공통_합의
7026,피해자는 평생 환경미화원을 하며 힘들게 번 돈으로 이 사건 분양계약을 체결하였다가 아직까지도 분양목적물에 관한 소유권을 이전받지 못하여 엄벌을 탄원하고 있다.,train,사기,탄원,공통_합의
7026,피고인에게 피해자와 합의하거나 피해를 회복할 기회를 부여하기 위하여 법정구속은 하지 않는다.,train,사기,합의,공통_합의
7029,피해자와 합의되지 아니한 점에 비추어 피고인에 대한 엄중한 처벌이 필요해 보인다.,train,사기,합의,공통_합의
7030,○ 불리한 정상 : 피해자로부터 용서받지 못하였고 피해회복 하지 못한 점,train,사기,용서,공통_합의
7031,피해자 G와 원만히 합의하여 위 피해자가 피고인에 대한 선처를 탄원하는 점,train,사기,합의,공통_합의
7032,피해자와 합의하여 피해자가 피고인의 처벌을 원치 않는 점 등을 피고인에게 유리한 정상으로 참작하고,train,사기,합의,공통_합의
7039,피해자와 원만히 합의하여 피해자는 피고인의 처벌을 원치 않고 있다.,train,사기,합의,공통_합의
7040,피해액 중 약 1억 원의 손해를 회복시켰고 피해자들과 합의한 점,train,사기,합의,공통_합의
7044,피해자와의 합의나 피해회복도 되지 않았고,train,사기,합의,공통_합의
7046,L과 합의하여 그들이 피고인의 처벌을 원하지 않는 점,train,사기,합의,공통_합의
7047,이후 피고인이 피해자와 편취금을 분할변제하기로 합의한 점,train,사기,합의,공통_합의
7048,피해가 회복되지 않고 있고 피해자로부터 용서받지도 못한 점,train,사기,용서,공통_합의
7053,이 사건 선고기일에 이르기까지 피해자의 피해를 회복하려고 노력하였다거나 용서를 받았다는 자료를 찾을 수 없다.,train,사기,용서,공통_합의
7054,피고인이 피해자와 원만히 합의한 후 합의금을 나누어 지급하는 등 피해 회복을 위해 노력하고 있는 점,train,사기,합의,공통_합의
7054,피해자가 피고인에 대한 처벌을 원하지 않는다는 내용의 탄원서를 제출한 점 등,train,사기,원하지,공통_합의
