id,sentence,dataSplit,casename,matched,ruleType
8648,당시 현장에 출동한 경찰관인 증인 E은 이 법정에서 '현장에 도착했을 당시에 피해자에게서 특별한 외상을 발견하지 못하였다'고 진술하고 있는 사정 등에 비추어 피고인이 행사한 유형력의 정도가 중하지 않았던 것으로 보이며,train,상해,중하,공통_정도
8649,이 사건 범행으로 피해자가 입은 상해의 정도 또한 가볍지 않다.,train,상해,가볍,공통_정도
8651,피고인이 피해자에게 가한 폭행의 정도가 가볍지 않고,train,상해,가볍,공통_정도
8651,피해자가 입은 상해도 그 정도가 가볍다고 보기 어려운 점,train,상해,가볍,공통_정도
8655,이 사건 범행은 일면식도 없는 피해자에게 시비를 걸고 일방적으로 폭행하여 상해를 가한 것으로서 그 죄질이 가볍지만은 않으나,train,상해,가볍,공통_정도
8656,피고인은 판시와 같이 피해자에게 상해를 가하여 피해자의 신체의 완전성을 훼손한 것으로 그 죄가 가볍다고 할 수 없다.,train,상해,가볍,공통_정도
8656,이 사건 범행으로 인한 피해자의 상해 정도가 비교적 중하지 아니하다는 점을 감안하더라도,train,상해,중하,공통_정도
8657,폭행의 정도가 가볍지 않은 점,train,상해,가볍,공통_정도
8657,피해자에게 발생한 상해 정도가 중하고,train,상해,중하,공통_정도
8658,피해자의 상해 정도가 무겁고,train,상해,무겁,공통_정도
8668,피고인의 범행으로 피해자는 두피 열상과 뇌진탕의 부상을 입게 되었는바 발생한 피해 역시 가볍지 아니하다.,train,상해,가볍,공통_정도
8668,이와 같이 거듭된 처벌에도 불구하고 유사한 범행을 반복하는 피고인에 대해서는 사회로부터의 격리와 그 죄책에 상응하는 엄중한 처벌이 불가피하다.,train,상해,중한,공통_정도
8675,[특별양형인자] 가중요소: 중한 상해 (1,train,상해,중한,공통_정도
8677,판시 제1항 범죄로 인하여 피해자가 입은 상해 정도가 중한 편인 점,train,상해,중한,공통_정도
8678,가중요소 : 중한 상해(1,train,상해,중한,공통_정도
8678,피해자의 장애정도와 노동능력 상실률이 매우 중한 정도는 아닌 것으로 보인다.,train,상해,중한,공통_정도
8681,피해자의 피해 부위 및 정도가 중한 점,train,상해,중한,공통_정도
8685,피고인이 피해자에게 상해를 가한 죄책이 가볍지는 않으나,train,상해,가볍,공통_정도
8687,비교적 피해자들이 입은 상해가 중하지 않은 사정은 인정된다.,train,상해,중하,공통_정도
8687,범행내용에 비추어 그 죄책이 무겁다.,train,상해,무겁,공통_정도
8689,피해자의 상해 정도 중하지는 않은 점,train,상해,중하,공통_정도
8691,피고인의 폭행으로 인해 피해자가 입은 부상 정도가 가볍지 않고,train,상해,가볍,공통_정도
8693,나) 만일 당시 피고인이 저지른 폭행이 매우 중하고 당시 생명의 위협을 느끼는 등 피해자가 매우 급박한 상황에 처해져 있었다면,train,상해,중하,공통_정도
8693,그러나 아래에서 보는 것처럼 피고인이 행사한 폭행의 정도가 무겁지 않고 당시 제3자가 피고인의 폭행을 말리고 있어서 피고인의 폭행 행위가 일정 시간 중단되어 있었던 것으로 보이는 상황 등을 고려하면,train,상해,무겁,공통_정도
9000,피고인의 폭행 행위가 피해자의 폭행 행위보다는 경미한 점을 비롯하여 피고인의 연령,train,폭행,경미,공통_정도
9009,피고인이 행사한 유형력의 정도 자체가 아주 중한 것으로 보이지는 않는 점은 피고인에게 유리한 정상이다.,train,폭행,중한,공통_정도
9016,폭행의 정도가 중하지는 않은 점 그 밖에 피고인의 나이,train,폭행,중하,공통_정도
9020,다만 피해 정도가 경미한 반면 피고인이 사건 과정에서 상해를 입은 점,train,폭행,경미,공통_정도
9022,피해자의 피해가 중하지 아니하며[피해자는 위 범죄사실 기재 일시 및 장소에서 피해자의 모자를 쳐서 떨어뜨리고,train,폭행,중하,공통_정도
9023,이 사건 폭행의 정도가 중하지는 아니한 점 등을 감안하더라도,train,폭행,중하,공통_정도
9044,피해자가 입은 피해의 정도가 매우 중한 것으로 보이지는 않는 점,train,폭행,중한,공통_정도
9055,피고인이 행사한 유형력의 내용이나 정도가 중하지 않은 점,train,폭행,중하,공통_정도
9063,그 불법성이 중하다.,train,폭행,중하,공통_정도
9066,피고인이 행사한 유형력의 정도가 매우 경미한 점(피고인의 행위로 오토바이가 넘어진 것이 아니라 피해자 스스로 오토바이를 넘어뜨린 것으로 보인다),train,폭행,경미,공통_정도
9071,○ 유리한 정상 : 폭행의 정도가 아주 중하지는 않은 것으로 보인다.,train,폭행,중하,공통_정도
9072,이 사건 범행은 피고인이 피해자의 얼굴 부위 등을 반복적으로 때린 것으로 폭행의 정도가 결코 가볍지 않고,train,폭행,가볍,공통_정도
9074,이 사건 폭행의 정도나 폭행 당시 피해자의 어린 아들이 보고 있음에도 피해자를 폭행한 점 등에 비추어 그 죄질이 가볍지 않다.,train,폭행,가볍,공통_정도
9075,피고인의 죄책이 결코 가볍지 아니한바,train,폭행,가볍,공통_정도
9076,○ 유리한 정상: 폭행의 정도가 중하지 않다.,train,폭행,중하,공통_정도
9078,피고인의 폭행 정도가 가볍지 않은 점,train,폭행,가볍,공통_정도
9080,피해자에게 행사한 유형력의 정도가 아주 중하지는 않다.,train,폭행,중하,공통_정도
9086,그러나 이 사건 폭행의 정도가 경미한 편이고,train,폭행,경미,공통_정도
9101,다행히 피해자가 입은 피해의 정도가 중하지는 않다.,train,폭행,중하,공통_정도
9107,피고인이 피해자를 폭행한 죄책이 가볍지는 않으나,train,폭행,가볍,공통_정도
9107,피해자가 피고인을 폭행한 정도에 비하면 피고인의 폭행은 비교적 경미한 점을 비롯하여 피고인의 연령,train,폭행,경미,공통_정도
9112,협박죄 및 존속상해죄 등으로 징역형을 선고받아 형의 집행을 마친 후 얼마 지나지 않아 다시 이 사건 범행을 저지른 점에 비추어 책임이 가볍지 않은 점,train,폭행,가볍,공통_정도
9113,피고인이 교도소에서 수용중에 있으면서 다른 수용자에게 폭행한 이 사건 범행의 죄책이 가볍지 아니하고,train,폭행,가볍,공통_정도
9123,피해의 정도가 중하지 아니한 점,train,폭행,중하,공통_정도
9128,비록 유형력 행사의 정도는 중하지 않으나,train,폭행,중하,공통_정도
9128,범행에 이른 동기나 경위에 비추어 죄책이 가볍지 않음에도,train,폭행,가볍,공통_정도
9128,판시 범행과 이를 전후한 피고인의 대응행위로 말미암은 피해자들의 피해감정 또한 상당한 것으로 보이는 점 및 그 밖에 이 사건 변론에 나타난 모든 양형 요소를 고려하여 피고인에게 약식명령에 정한 형보다 중한 형을 선고한다.,train,폭행,중한,공통_정도
9136,피고인이 피해자에게 가한 폭행의 정도가 경미하나,train,폭행,경미,공통_정도
9152,그 폭행의 정도가 가볍지 않을 뿐만 아니라 자원봉사를 하는 고령의 피해자(68세)를 상대로 위와 같은 범행을 저질렀다는 점에서 죄질이 좋지 않은 점,train,폭행,가볍,공통_정도
9159,당시 행사한 폭행의 정도가 중하지 않고,train,폭행,중하,공통_정도
9162,그 밖에 이 사건 변론에 나타난 모든 양형 요소를 고려하여 피고인에 대하여 약식명령에 정한 형보다 중한 형을 선고한다.,train,폭행,중한,공통_정도
9168,이 사건 피해자들의 수 및 피해 정도에 비추어 죄책이 가볍지 않은 점,train,폭행,가볍,공통_정도
9177,피고인은 이 사건 범행 당시 아무런 이유 없이 피해자에게 심한 욕설을 하고 피해자를 여러 차례 폭행하는 등 그 범행수법 및 피해의 정도 등에 비추어 죄질이 가볍다고 보기 어려운 점,train,폭행,가볍,공통_정도
9178,피고인이 피해자에게 행사한 폭행의 정도가 크게 무겁지 않으나,train,폭행,무겁,공통_정도
9185,피고인의 죄책이 피해자와 비교할 때 특별히 더 가볍거나 무겁다고 볼 수 없는 점 및 그 밖에 제반 양형 조건을 참작하여 주문과 같이 형을 정한다.,train,폭행,가볍,공통_정도
9192,폭행의 정도가 다른 사건과 비교하여 상대적으로 경미하다.,train,폭행,경미,공통_정도
9214,피고인이 운전 중인 피해자에게 욕설과 함께 폭행을 가한 이 사건에 있어 피고인의 책임이 가볍지 아니한 점,train,폭행,가볍,공통_정도
9216,행사한 유형력 비교적 중하지 않은 점,train,폭행,중하,공통_정도
9219,이 사건 폭행의 태양이 팔꿈치로 입술부위를 치는 등 가볍지 아니한 점,train,폭행,가볍,공통_정도
9220,피고인이 행사한 유형력의 정도가 비교적 가볍고,train,폭행,가볍,공통_정도
9262,피고인이 고령이고 피해 정도가 가볍기는 하나,train,폭행,가볍,공통_정도
9272,행사한 폭력의 정도가 경미하고 범행으로 인한 피해 규모가 크지는 않은 점 등을 참작하여 주문과 같이 선고형을 정한다.,train,폭행,경미,공통_정도
9279,피고인이 대화 중 화가 난다는 이유로 피해자를 폭행한 점에 비추어 보면 피고인의 책임이 가볍지 않다.,train,폭행,가볍,공통_정도
9279,폭행의 정도가 그다지 무겁지 않다.,train,폭행,무겁,공통_정도
9291,피해자에게 중한 결과가 발생하지 않은 점은 피고인에게 유리한 정상으로 참작한다.,train,폭행,중한,공통_정도
9293,이 사건은 피고인이 피해자의 얼굴부위를 주먹으로 폭행한 사건으로 피고인이 행위로 인하여 발생한 결과로 피해자는 숭고한 생명을 잃게 되어 그 책임이 가볍지 않은 점,train,폭행,가볍,공통_정도
9297,피해자가 이를 피하는데도 집요하게 따라가면서 폭행한 사건으로서 죄질이 중한 점,train,폭행,중한,공통_정도
9303,이 사건 범행은 단순히 피해자를 폭행한 정도에 그친 것이 아니라 피해자와 그 가족이 운영하는 상점의 간판을 발로 차고 피해자의 부모에게 심한 욕설을 하면서 영업을 방해하는 행위까지 저지른 것으로 그 범행수법 및 피해의 정도 등에 비추어 죄질이 가볍다고 보기 어려운 점,train,폭행,가볍,공통_정도
9306,목격자인 D도 수사기관의 전화조사 당시 피고인이 피해자에게 피해자의 이사차량 때문에 통행이 불편하다고 항의하면서 손으로 가슴을 밀쳤는데 그 정도가 폭행이라고 볼 수 없을 정도로 경미하였다고 진술을 하였으므로(증거목록 순번 7),train,폭행,경미,공통_정도
9313,그러나 피고인이 피해자에 대해 행사한 유형력의 정도가 아주 가볍지는 않은 점,train,폭행,가볍,공통_정도
9319,피고인은 아무런 이유 없이 피해자에게 폭력을 행사한 것으로 그 죄가 결코 가볍다고 할 수 없다.,train,폭행,가볍,공통_정도
9324,이 사건 폭행의 정도가 중하지 않은 점,train,폭행,중하,공통_정도
9326,이 사건 범행은 그 방법 등에 비추어 그 죄질 및 범정이 가볍지 아니하고,train,폭행,가볍,공통_정도
9327,이 사건에 있어 피고인의 폭행 정도가 상대적으로 경미한 점,train,폭행,경미,공통_정도
9327,피고인도 이 사건의 결과 비교적 중한 상해를 입은 점,train,폭행,중한,공통_정도
9327,이러한 이 사건의 경위와 피고인의 폭행 방법 등에 비추어 이 사건에 있어서 피고인의 책임이 피해자와 비교하여 아주 경미하다고 보기는 어렵다.,train,폭행,경미,공통_정도
9327,피고인에게 이 사건 약식명령에서 정한 것보다 중한 형을 선고하기로 한다.,train,폭행,중한,공통_정도
9331,유형력의 행사 중하지 않은 점,train,폭행,중하,공통_정도
9336,이 사건 범행 경위 및 행위태양 등에 비추어 죄질이 가볍지 않은 점,train,폭행,가볍,공통_정도
9337,피고인이 피해자에 대해 행사한 유형력의 정도가 상대적으로 그리 중하지는 않았던 점,train,폭행,중하,공통_정도
9352,피고인이 범행 과정에서 행사한 유형력의 정도가 상대적으로 중하지 않고,train,폭행,중하,공통_정도
9356,피고인이 자신의 잘못을 반성하고 있고 폭행의 정도가 중하지는 않다.,train,폭행,중하,공통_정도
9360,이 사건 범행으로 인한 피해의 정도가 비교적 경미한 편이고,train,폭행,경미,공통_정도
9376,피고인이 행사한 유형력의 정도가 크지 않고 피해자가 입은 피해정도도 비교적 경미하다.,train,폭행,경미,공통_정도
9381,정신적 고통의 정도가 가볍지 않고,train,폭행,가볍,공통_정도
9392,피해자는 다행히 피고인이 휘두른 팔에 맞지 않았고 피해도 비교적 경미한 점,train,폭행,경미,공통_정도
9402,폭행의 정도가 중하지는 않다.,train,폭행,중하,공통_정도
9403,폭행의 정도가 중하지는 않은 점 등의 유리한 정상,train,폭행,중하,공통_정도
9411,폭행 정도가 중하지 않은 점,train,폭행,중하,공통_정도
9413,▪ 피고인이 행사한 유형력의 정도가 중하지는 않다.,train,폭행,중하,공통_정도
9415,범행 장소가 다수의 환자들이 출입하는 병원 응급실인 점에 비추어 그 행위가 가볍지 않다.,train,폭행,가볍,공통_정도
9422,영상에 의하면 단 한 차례 피해자의 머리채를 잡아당긴 것인 것에 불과하고 그 정도 또한 경미해 보이며 그 외에 별다른 행위를 하지 아니한 점,train,폭행,경미,공통_정도
9430,이 사건 범행수법 및 피해의 정도 등에 비추어 죄질이 가볍지 않은 점,train,폭행,가볍,공통_정도
9444,폭행 정도가 중하고,train,폭행,중하,공통_정도
9446,피해자가 고소부터 이 법정에 이르기까지 CCTV 영상과 전혀 다른 허위·과장된 고소와 진술을 하고 있어 CCTV가 없었던 경우 피고인이 자칫 더 중한 범행으로 처벌받을 위험이 있었던 점(피해자는 피고인에게 4주 상해진단서를 발급받았고 피고인이 사과하지 아니하면 피고인이 구속될 것이라는 문자메시지를 보내었다),train,폭행,중한,공통_정도
9458,피고인이 행사한 유형력의 정도가 가볍지 않은 점,train,폭행,가볍,공통_정도
9468,○ 유리한 정상: 폭행의 정도가 매우 중하였다고 보이지는 않는 점,train,폭행,중하,공통_정도
9469,[특별양형인자] 감경요소: 폭행의 정도가 경미한 경우(1,train,폭행,경미,공통_정도
9469,그럼에도 자중하지 않고 또 다시 술에 취해 피해자를 때릴 듯이 위협하다 폭력을 행사하고 그 과정에서 피해자측으로부터 폭행을 당한 것처럼 보이려는 행태까지 취하여 죄질이 좋지 못한 점,train,폭행,중하,공통_정도
9469,폭행 정도는 경미한 점은 유리한 정상으로 참작한다.,train,폭행,경미,공통_정도
9479,폭행의 정도가 중하지 않은 점 등과 그 밖에 피고인의 나이,train,폭행,중하,공통_정도
9487,[유리한 정상] 폭행 정도가 그리 중하지는 않음,train,폭행,중하,공통_정도
9489,행사한 유형력 중하지 않고 형제간 다툼 과정에서 발생한 사건인 점,train,폭행,중하,공통_정도
9492,이 사건 각 폭행의 정도가 매우 중하였던 것으로 보이지는 않는다.,train,폭행,중하,공통_정도
9506,피해자가 입은 피해정도는 비교적 중하지 않다.,train,폭행,중하,공통_정도
9509,이 사건 범행에서 피고인이 행사한 유형력의 정도가 경미하고,train,폭행,경미,공통_정도
9510,폭행의 태양이 비교적 경미한 점,train,폭행,경미,공통_정도
9515,피해자는 피고인의 이 사건 범죄행위로 말미암아 놀라는 바람에 운행하던 화물차가 휘청거리며 사고가 날 뻔했다고 진술하는 등 사안이 가볍지 않고,train,폭행,가볍,공통_정도
9519,피고인이 행사한 유형력의 정도가 그리 중하지는 않았던 것으로 보이는 점,train,폭행,중하,공통_정도
9520,그러나 피고인은 흥분한 상태에 있던 피해자를 보고 우발적으로 어깨를 밀치게 된 것이고 그 폭행 정도가 경미한 것으로 보이는 점,train,폭행,경미,공통_정도
9520,범행 후의 정황 등 이 사건 기록과 변론에 나타난 모든 양형 조건들을 종합하면 피고인에게 부과된 약식명령의 벌금은 과중하다고 보이므로 감액하기로 하여 주문과 같이 형을 정한다.,train,폭행,중하,공통_정도
9522,피고인이 도구를 이용해 피해자를 폭행하였고 그 폭행의 정도도 가볍지 않았던 점,train,폭행,가볍,공통_정도
9531,〇 CCTV 영상에서 확인되는 이 사건 범행의 태양에 비추어 폭행의 정도는 경미한 것으로 보이고,train,폭행,경미,공통_정도
9536,피고인이 행사한 유형력의 정도가 중하지 않은 점 및 그밖에 피고인의 나이와 직업,train,폭행,중하,공통_정도
9542,술에 취해 아무 이유 없이 차량에 들어가 피해자를 주먹으로 1회 때린 행위는 죄질이 나쁘다.,train,폭행,나쁘,공통_정도
9544,그 밖에도 폭행 관련 처벌전력만 13회가 있음에도 불구하고 자중하지 않고 다시 이 사건 범행에 이르게 되어 폭력을 금하는 법질서를 경시하는 정도가 크다.,train,폭행,중하,공통_정도
9544,상해진단서의 객관성과 신빙성을 의심할 만한 사정이 있는 때에는 그 증명력을 판단하는 데 매우 신중하여야 한다.,train,폭행,중하,공통_정도
9549,2017. 5. 25.자 폭행 및 8. 28.자 폭행은 부부싸움 도중에 벌어진 일로서 서로에 대한 몰이해와 상대를 존중하지 않는 태도에서 비롯된 것이고,train,폭행,중하,공통_정도
9561,폭행 정도가 중하지는 않은 점,train,폭행,중하,공통_정도
9565,유형력 행사의 정도가 중하지 않은 점을 고려하면 약식명령의 벌금이 적정하다고 판단되므로 주문과 같이 판결한다.,train,폭행,중하,공통_정도
9574,피해자가 가한 폭력의 정도가 피고인이 가한 폭력의 정도보다 중하였던 점,train,폭행,중하,공통_정도
9581,유형력 행사의 정도 비교적 중하지 않은 점,train,폭행,중하,공통_정도
9594,유형력의 행사 정도가 아주 중하다고 보기는 다소간 어려운 점,train,폭행,중하,공통_정도
9607,살피건대 이 사건 범행은 피고인이 손으로 피해자의 목을 잡고 밀치는 등 폭행한 것으로 범행내용에 비추어 죄책이 가볍지 않은 점,train,폭행,가볍,공통_정도
9607,피고인이 행사한 유형력이 매우 중하지는 않은 점,train,폭행,중하,공통_정도
9614,이 사건 범행은 피고인이 술에 취하여 아무런 이유 없이 피해자의 목을 조르는 등으로 폭행한 것으로 피해자 선정의 무차별성이나 이 사건 폭행의 방법과 정도 등에 비추어 그 범정 및 죄질이 결코 가볍지 아니한 점,train,폭행,가볍,공통_정도
9616,폭행의 정도를 볼 때 이 사건 각 범행은 그 죄질이 가볍지 아니한 점,train,폭행,가볍,공통_정도
9619,피해 정도가 비교적 경미하다.,train,폭행,경미,공통_정도
9625,폭행의 정도가 상대적으로 경미한 점,train,폭행,경미,공통_정도
9635,비록 피해자가 피고인에게 따라오라고 하여 쌍방 폭행이 시작되었으나 피고인의 폭행의 정도가 가볍다고 볼 수 없는 점,train,폭행,가볍,공통_정도
9645,폭행 및 이로 인한 피해 정도가 매우 중하지는 아니하고 피해자 역시 다툼 과정에서 피고인의 행동에 비해 과장된 반응을 보이면서 넘어지는 등 정상에 참작할 사정이 있는 점,train,폭행,중하,공통_정도
9646,폭행의 정도가 경미하다.,train,폭행,경미,공통_정도
9654,정도에 비추어 죄질 나쁘다.,train,폭행,나쁘,공통_정도
9661,다만 폭행의 방법과 피해 정도가 비교적 중하지 아니한 점을 긍정적인 정상으로 참작하고,train,폭행,중하,공통_정도
9662,폭행정도 중하지 아니한 점은 피고인에게 유리한 정상으로 각 참작한다.,train,폭행,중하,공통_정도
9687,이 사건 범행의 경위와 수단 및 방법 등에 비추어 볼 때 죄책이 결코 가볍지 않다.,train,폭행,가볍,공통_정도
9696,폭행의 강도가 비교적 중하지 않은 점 등을 비롯하여 피고인의 나이,train,폭행,중하,공통_정도
9705,그런데 국민건강보험법상 보험급여 제한 사유로 규정된 ‘고의 또는 중대한 과실로 인한 범죄행위에 기인한 경우’는 ‘고의 또는 중대한 과실로 인한 자기의 범죄행위에 전적으로 기인하여 보험사고가 발생하였거나 고의 또는 중대한 과실로 인한 자신의 범죄행위가 주된 원인이 되어 보험사고가 발생한 경우’를 말하는 것으로 해석함이 상당한바(대법원 2010. 6. 10. 선고 2010도1777 판결 참조),train,폭행,중대,공통_정도
9721,피고인은 이미 십여 차례 폭력 범죄로 처벌받은 전력이 있음에도 별다른 이유 없이 또다시 피해자들을 폭행하였는바 그 죄책이 가볍지 않고,train,폭행,가볍,공통_정도
9723,폭행 정도가 경미한 점,train,폭행,경미,공통_정도
9729,이 사건 폭행의 정도가 가볍지 않은 점,train,폭행,가볍,공통_정도
9730,범행 내용 및 환자들의 안정이 필요한 병원 응급실에서의 범행인 사정 등에 비추어 그 죄책이 무겁다.,train,폭행,무겁,공통_정도
9732,000원은 다소 무겁다고 보이므로,train,폭행,무겁,공통_정도
9733,술에 취해 무고한 택시기사를 상대로 폭력을 휘두르는 범행은 죄질이 나쁘다.,train,폭행,나쁘,공통_정도
9746,이 사건 범행 당시 피고인이 행사한 유형력의 정도가 무겁지 않은 점,train,폭행,무겁,공통_정도
9758,피고인은 자신의 잘못을 반성하고 있으며 폭력의 정도가 비교적 중하지 아니하다.,train,폭행,중하,공통_정도
9771,폭행의 정도 등에 비추어 볼 때 결코 죄책이 가볍다고 보기 어렵다.,train,폭행,가볍,공통_정도
9784,하급자의 인격과 명예를 존중하고 하급자에 대하여 업무와 관련 없는 지시를 하지 아니하도록 규정하고 있다.,train,폭행,중하,공통_정도
9784,이와 같이 국민의 인권을 보호하여야 할 위치에 있는 피고인이 그 지위를 남용하여 폭력을 저질렀다는 것은 위법성이 매우 중대하다.,train,폭행,중대,공통_정도
9786,폭행 정도도 가볍지 아니하며,train,폭행,가볍,공통_정도
9792,피해자에 대한 폭행의 정도가 비교적 중하지 않은 점을 유리한 정상으로 참작한다.,train,폭행,중하,공통_정도
9793,피해 정도가 비교적 경미한 점,train,폭행,경미,공통_정도
9807,피해변상에 별다른 노력을 하지 않고 있는 점 등을 종합하면 죄책을 가볍게 볼 수 없고 술에 취하면 잠재된 폭력성이 폭발하는 경향이 있어 재범의 위험성이 우려되므로 엄중한 경고가 필요하여 징역형을 선택함.,train,폭행,가볍,공통_정도
9820,이 사건 폭행의 정도가 비교적 경미한 점,train,폭행,경미,공통_정도
9823,피고인이 행사한 유형력의 정도가 중하지는 아니한 점 및 그 밖에 피고인의 연령,train,폭행,중하,공통_정도
9842,피고인이 행사한 유형력의 정도가 중하지는 아니한 점 및 그 밖에 피고인의 나이,train,폭행,중하,공통_정도
9846,유형력 행사와 피해정도가 비교적 경미한 점,train,폭행,경미,공통_정도
9850,피고인이 가한 폭행의 정도가 상대적으로 경미한 편이다.,train,폭행,경미,공통_정도
9852,피고인은 피해를 회복하기 위해 별다른 노력을 기울이지 않고 있는 점 등을 고려하면 피고인의 죄책이 가볍지 않다.,train,폭행,가볍,공통_정도
9855,피고인이 대리운전 요금 문제로 시비를 하다가 폭행을 가하여 그 죄책이 가볍다고 할 수 없고,train,폭행,가볍,공통_정도
9855,피고인의 폭행의 정도가 비교적 경미한 점,train,폭행,경미,공통_정도
9856,폭행의 경위에 비추어 그 죄질이 나쁘다 할 것이다.,train,폭행,나쁘,공통_정도
9867,그러나 피고인이 별다른 이유 없이 이웃인 여성 피해자에게 라면을 뿌리고 손으로 머리를 때린 죄질이 가볍지 않고,train,폭행,가볍,공통_정도
